ID	CONCEPTICON_ID	CONCEPTICON_GLOSS	FORM	MEANING	SENSE	SENSE_ID
1953	2396	KNOCK	ver	prügeln;  schlagen;  schlagen;  zanken;   Bündel;  stoßen;   Prügel;   Prügel;   treiben;   drehen;   stechen;   niederwerfen;   klopfen;   hämmern;  vernichten;   bestrafen;  flechten;   Strafe;   kämpfen;   Gepräge;   Hammer;  Schweiß〉;  niederschlagen;   pochen;   schlagen 〈Naturerscheinung〉;  durch Schlagen Töne erzeugen;  in einen Zustand bringen;   anschlagen 〈Schaum;  seilen;   an etw befestigen;  klopfen 〈Herz〉;   mit dem bösen Blick treffen;   Schlagen;   Niedergeschlagenheit;   Niederlage;   mit Kanonen beschießen;   sich mit jmdm raufen	  klopfen	klopfen-7
1954	2396	KNOCK	zakatol	 belästigen; treiben;  lärmen;   stottern;   klopfen	  klopfen	klopfen-8
1955	760	KNOT	bog	 Ast; Knoten;  Knorren;   Glied	Knoten	Knoten-1
1956	760	KNOT	bogyó	Beere;   Knoten;   dürre Frucht;   unreifer Apfel	  Knoten	Knoten-2
1957	760	KNOT	bojt	 Quaste;   Knoten;  Knorren; Büschel;  Zottel;  Behang;   Tannenzweig;   Pfropfreis;  Pflänzling;   junger Nadelbaum;  Gruppe von Nadelbäumen	  Knoten	Knoten-3
1958	760	KNOT	buckó ×	  Knoten; massig;  gedrungen;  Ausbauchung	  Knoten	Knoten-4
1959	760	KNOT	bunkó	 Wesen; Knoten;   Kolben;   Note »ungenügend«;  Gelenkknorren;   Knotenstock;  Stampfer;   Kern;   Grobheit;   Lümmel;  Lackel;   grob tadeln	Knoten	Knoten-5
1960	760	KNOT	butykó ×	Knoten;   Knotenstock;  Schwellung	Knoten	Knoten-6
1961	760	KNOT	bütyök	Knoten;   Gelenkknorren;  Auswuchs 〈bes an Zehen od Fingern〉	Knoten	Knoten-7
1962	760	KNOT	csimbók ×	Knoten;   Zopf;   Knopf;   Art Knollengewächs;   Person von niedrigem Wuchs	Knoten	Knoten-8
1963	760	KNOT	csombolyék ×	Bündel;   Knoten;   Zopf	  Knoten	Knoten-9
1964	760	KNOT	csög-bog ×	  Mist;   Knoten;  Knorren;   Verwicklung; Krüppel;  verkümmertes Lebewesen;   unfruchtbarer Obstbaum	  Knoten	Knoten-10
1965	760	KNOT	csömbölyék ×	Knoten;  Knorren	Knoten	Knoten-11
1966	760	KNOT	gomb	  Knoten;   Augapfel;   Ohrläppchen;   Obst;   Kugel; Knopf 〈am Kleid usw〉;  Schaumblase;  apfelähnl kleine Frucht;   zusammengeflochtener Haarbusch 〈haupts der Männer〉	  Knoten	Knoten-12
1967	760	KNOT	göb ×	 Knoten;   Buckel;  Beule; Knopf am Kleide	 Knoten	Knoten-13
1968	760	KNOT	görcs	  Geschwulst;  Knoten;  Klotz;   Schindmähre; Krampf;   Holzknorren;   Verschlingung von Schnüren;   Holzklotz am Ende des Brunnenschwengels;  Strunk;   magerer Mensch von kleinem Wuchs	 Knoten	Knoten-14
1969	760	KNOT	pöfeteg	  Geschwulst;  Knoten; Staubpilz	 Knoten	Knoten-15
1970	1410	KNOW (SOMETHING)	tud	  einrechnen;  meinen;   Gelehrter;  ahnen;   Erkundigung;   Wissenschaft;   können;  verrichten;   überzeugt sein;  abtragen; jmdn kennen;  von jmdm Kenntnis haben;  etw wissen;  entschlossen sein;  Zuversicht haben;   mit jmdm Geschlechtsverkehr haben;  aufrechnen;  aufschreiben;   jmdn um etw bringen;  jmdn verjagen;   abrechnen;   gelehrt;   gelehrt;   Wissen;   überklug;   überklug;  gelehrsam;   Bewußtsein	  Wissen	Wissen-1
1971	1464	LADDER	főnök	Führer;  Häuptling;   Chef;  Leiter	 Leiter	Leiter-1
1972	1464	LADDER	hágcsó	 Stufe; Leiter;   Treppe;  Auftritt;   Durchgang zwischen Gärten;   Durchgang zwischen Gärten;   Dachboden	Leiter	Leiter-2
1973	1464	LADDER	lábító ×	Leiter;   Pedal;   Fußschemel	Leiter	Leiter-3
1974	1464	LADDER	rektor	 Lehrer;   Leiter; Schuldirektor;   Rektor 〈einer Akademie bzw Universität〉;  Vorsteher 〈von Studierenden〉;   kirchlicher Vorgesetzter	  Leiter	Leiter-4
1975	1464	LADDER	létra	die Leiter;   Wagenleiter;   Tonleiter;   hochgeschossener Mensch	die Leiter	dieLeiter-1
1976	1464	LADDER	taroglya ×	  Art Fischernetz;   die Leiter;  Tragbahre; Art kleiner Karren;   gitterartige Trage	  die Leiter	dieLeiter-2
1977	1464	LADDER	záp² ×	  Rapeiche;   Knebel; Sprosse der Wagenleiter;  der Leiter;  Bolzen 〈in der Schiffahrt〉;   Strebeholz	 der Leiter	derLeiter-1
1978	2949	LAIR	konstrukció	  Zusammensetzung; Wortfügung;  Satzbau;  Bau;  Gefüge	 Bau	Bau-1
1979	2949	LAIR	teknő	  Flußbett;  Mulde;   Bau;   Waschbecken; Talmulde;   Trog;  Wanne;   Teil des Schiffes unter der Wasserlinie;   Teil der Wassermühle;  Lager vom Wild;   beschildet 〈Reptil〉;   Schildkröte	  Bau	Bau-2
1980	624	LAKE	strand	See-;  Meeresufer;   Strandbad	See-	See-1
1981	624	LAKE	tenger	  Unmenge;   ungeheuer;  unzählig;  See; Meer;   Meer-	 See	See-2
1982	624	LAKE	tó	 Teich;    Teich; See	See	See-3
1983	1307	LANGUAGE	nyelv	  Rede;   Erklärung; Zunge;  Schprachgebrauch;   Sprache;   Sprache;   zungeförmiges Ding;   sprechende Person;   milit Geheimnisse preisgebender Gefangener;   außersprachliches Ausdrucksmittel;  Sprachgebrauch	  Sprache	Sprache-1
1984	1307	LANGUAGE	nyelv	  Rede;   Erklärung; Zunge;  Schprachgebrauch;   Sprache;   Sprache;   zungeförmiges Ding;   sprechende Person;   milit Geheimnisse preisgebender Gefangener;   außersprachliches Ausdrucksmittel;  Sprachgebrauch	  Sprache	Sprache-2
1985	1529	LAST (FINAL)	utó	  Ende;   Hinterteil;   Nachkomme;   Rand; letzter;   am Ende befindlich;   Hintergetreide	letzter	letzter-1
1986	1529	LAST (FINAL)	utol	  über;   Hinterteil;   Rand;   hinten;  Nachkommenschaft;   letzter; Überrest 〈einer Menschengruppe〉;   Ende 〈eines Vorgangs;  Zeitabschnitts〉;   letzter Teil;  Schlußteil;   weiter hinten;   zum letzten Mal;   zuletzt;   nach hinten;   nachträglich	  letzter	letzter-2
1987	1355	LAUGH	döcög	 kichern; zittern;   holpern;  watscheln;   lachen	  lachen	lachen-1
1988	1355	LAUGH	kacag	 lachen;   wiehern	 lachen	lachen-2
1989	1355	LAUGH	nevet	  kichern; lachen	lachen	lachen-3
1990	1355	LAUGH	visít	 Gerät〉;   brausen; zwitschern;   lachen;   quietschen;   einen schrillen Laut hören lassen 〈Gegenstand;  sausen 〈Wind〉;   knirschen 〈Scnee〉	  lachen	lachen-4
1991	2958	LAUGHTER	csatara ×	 Lärm;   geschwätzig; Gelächter;   Geschwätz;   schnatterig	Gelächter	Gelachter-1
1992	2071	LAY (VERB)	csinál	 verfertigen; herstellen;  stellen;   tun;   entstehen;  errichten;   ausbessern;  machen;   hecheln;   legen;   zeugen;  beischlafe 〈in euphem Ausdrücken〉;   verursachen;   Schein-;  erkünstelt	  legen	legen-1
1993	2071	LAY (VERB)	rak	  prügeln;   tanzen;   Haufen;   legen;    legen;   voll;    ab-; bauen;   bauen lassen;  sich anhäufen;    setzen;   beschimpfen;  Stapel;  beladen;  laden;   Einlegearbeit machen;   aufzählen;   in Reihen anpflanzen;    hinstellen;  hinlegen;  einen Einsatz zahlen;  legen lassen;  überhäuft;  aufladen;   sich anlagern;   Schaufenster	  legen	legen-2
1994	2071	LAY (VERB)	rak	  prügeln;   tanzen;   Haufen;   legen;    legen;   voll;    ab-; bauen;   bauen lassen;  sich anhäufen;    setzen;   beschimpfen;  Stapel;  beladen;  laden;   Einlegearbeit machen;   aufzählen;   in Reihen anpflanzen;    hinstellen;  hinlegen;  einen Einsatz zahlen;  legen lassen;  überhäuft;  aufladen;   sich anlagern;   Schaufenster	   legen	legen-3
1995	2071	LAY (VERB)	tesz	  Handlung;   Tat;   Tat;  mächtig;   hinzufügen;  kräftig;   wohlhabend;   beschließen; handeln;   legen;   stark;   Fähigkeit;   Vermögen;  durchführen;   sich verstellen;   wirksam;   untätig;   für etw halten;   bedeuten;   begabt;   bewirken;  in irgendeine Lage versetzen;  verursachen: schaffen;   verzichten;  aufgeben;  voraussetzen;   betragen;  ausmachen;  symbolisieren;  bestimmen 〈Aufgabe;  Ziel usw〉;   gute Leistung erzielen;   deutlich;   Ankleide- 〈<in attr Funktion〉;   Einsatz;   Tun. Handlung;   satz;  Ausführung;  Ausführung;   Schöpfer;   Ofentür;   etw nicht ausführend 〈Adv〉;   untätig 〈Adv〉;   etw nicht tun könnend;   talentlos;   tuend;   tätig;   hin und her legen;   Täter	  legen	legen-4
1996	2071	LAY (VERB)	tosz ×	 stellen;   mit jmdm geschlechtlich verkehren;  stoßen;  legen; stecken;   schieben;   etw anderen auferlegen	 legen	legen-5
1997	2071	LAY (VERB)	tüntet	 legen;   auszeichnen;   vernichten;   in Erinnerung bringen;   sich hervortun;   verschwinden lassen;  einstellen;   Aufsehen erregen; verwandeln;  umändern;   erscheinen lassen;   bezeigen;  an gut sichtbare Stelle auffällig setzen;  belohnen;   demonstrieren	 legen	legen-6
1998	2071	LAY (VERB)	vet	 stellen;   ungefähr;  legen;  streiten; säen;  annähernd;   wetteifern;   verachten;  einsetzen 〈Pflanze〉;   jmdn od etw irgendwohin setzen;  werfen 〈auch abstr〉;   〈Wasser〉 wegleiten;  ablassen;  verschmähen;   lösen 〈Aufgabe〉;   sich werfen 〈Sport〉;   werfen 〈iter〉;   abortieren	 legen	legen-7
1999	1564	LAZY	alamuszi	unbeholfen;  ungeschickt;   träge;  faul;   verschlafen;   heimtückisch	  träge	trage-1
2000	1564	LAZY	lágy	  träge;   sanft;  fein;   mild;   lau; weich;   flaumweich;  zärtlich;   wäßrig;   von niedrigem Schmelzpunkt 〈Metall〉;   weich 〈Wasser〉;   palatalisiert 〈Laut〉;   Moll- 〈Tonart〉;   zerfließend;   Hirnblatt	  träge	trage-2
2001	1564	LAZY	lajhár	  träge;  faul; unsinnig;  verrückt;  schwerfällig;   ungeschlacht;   Faulpelz;   Faultier	  träge	trage-3
2002	1564	LAZY	langaléta	  träge; halbnackt;  schwerfällig 〈Person〉;   hochgeschossen 〈junger Mann〉	  träge	trage-4
2003	1564	LAZY	lanyha	 träge;   faul;  schwach;   still;   liederlich;   lau;   naschhaft; weichlich;  rieselnd 〈Regen〉;   stiller;  rieselnder Regen	 träge	trage-5
2004	1564	LAZY	lomha	  träge;  faul;   unsinnig;  verrückt;  gefräßig; naschhaft	  träge	trage-6
2005	1564	LAZY	lusta	 träge;   faul;   unverziert;  untätig; von einer gewissen Gangart 〈Pferd〉;  unschön	 träge	trage-7
2006	1564	LAZY	ostoba	 träge;   faul; dumm;  grob;  derb;   plump;  unwissend;  ungeschlacht;  blöd	 träge	trage-8
2007	1564	LAZY	pacuha	 träge;   faul;   schlampig;  Kram;  Plunder; Kleidungsstück;   weich;   Habseligkeiten	 träge	trage-9
2008	1564	LAZY	pimasz	 unbeholfen;  träge;   dumm;   Gauner; unverschämt;  Bandit;  Strolch;  Lümmel;  frech;  Umstand〉;   geschmacklos;   Flegel;   Bengel;  Ungeheuer;   nichtstuend;  täppisch;   ungeheuer groß 〈Ding〉;   übel;  schlimm 〈Zustand;  Koloß	 träge	trage-10
2009	1564	LAZY	renyhe	 träge; faul;  Gestüt〉;   nicht für Zucht bestimmt 〈Pferde;   die Stimmung der Untätigkeit;  des trägen Wohlstan hervorrufend 〈Zustand. Gegenstand〉;   träge 〈physiologische Funktion〉	 träge	trage-11
2010	1564	LAZY	rest	 träge;  faul;   sich schämen; arbeitsscheu;   zu faul sein;  etw zu tun;  ungern etw tun;   sich genieren;  sich genieren;   zu faul sein zu etw;  widerwillig sein	 träge	trage-12
2011	1564	LAZY	slampet ×	 träge; faul;  zerlumpt;   schlampig 〈haupts Frau〉	 träge	trage-13
2012	1564	LAZY	susnya †	 träge;   faul;  zerlumpt; schmutzig;   aus dem Magen übel riechend;   furchtsames Kind	 träge	trage-14
2013	1564	LAZY	szuszma ×	unbeholfen;  träge;   Seele;   Atem;   schweigsam	 träge	trage-15
2014	1564	LAZY	tohonya	 träge; faul;   plump;  groß	 träge	trage-16
2015	1564	LAZY	totyakos	 träge; schwerfällig;   dickleibig;  mit großem Gesäß 〈Person〉;   von verwahrlostem Aussehen	 träge	trage-17
2016	1564	LAZY	trampli	  träge;  derb;  plump;   ungeschlacht; Trampel;   plumper;  breiter Fuß	  träge	trage-18
2017	1564	LAZY	trehány	 lumpig;   niederträchtig;   träge;   schlampig; zerlumpt;  nachlässig	  träge	trage-19
2018	1564	LAZY	tunya	träge;   faul;  dumm;   töricht;  plump;   leicht;  müßig;  untätig;   feige;   molett 〈Weib〉;  träge sein	träge	trage-20
2019	1564	LAZY	alamuszi	unbeholfen;  ungeschickt;   träge;  faul;   verschlafen;   heimtückisch	 faul	faul-1
2020	1564	LAZY	dundi	 faul; einfältig;   pummelig	 faul	faul-2
2021	1564	LAZY	henye	 faul;  oberflächlich; müßig;  untätig;   unbedacht	 faul	faul-3
2022	1564	LAZY	lajhár	  träge;  faul; unsinnig;  verrückt;  schwerfällig;   ungeschlacht;   Faulpelz;   Faultier	 faul	faul-4
2023	1564	LAZY	lanyha	 träge;   faul;  schwach;   still;   liederlich;   lau;   naschhaft; weichlich;  rieselnd 〈Regen〉;   stiller;  rieselnder Regen	  faul	faul-5
2024	1564	LAZY	laza	 faul; schütter;  Spreu;  spärlich;  verfallen;   taube Ähre;  leichtsinnig;  sich zerstreuend;   von schwachem Körperbau;   nicht streng;   locker;   verweichlicht;   ungenau;   locker 〈Verbindung〉;   lockerer;  wertloser;  geringfügiger Teil;   leerer;  schütterer Teil eines Obstgartens;   Kohl mit lockeren Blättern;   schütterer Wald	 faul	faul-6
2025	1564	LAZY	lomha	  träge;  faul;   unsinnig;  verrückt;  gefräßig; naschhaft	 faul	faul-7
2026	1564	LAZY	lusta	 träge;   faul;   unverziert;  untätig; von einer gewissen Gangart 〈Pferd〉;  unschön	  faul	faul-8
2027	1564	LAZY	málé	 faul;   Einfaltspinsel;   Mais;   blöd; Hirse;   trag;   Hirsebrei;  Fladen aus Hirsemehl;   Maisbrei;   Maiskuchen;   Maisschrot;  Maismehl	 faul	faul-9
2028	1564	LAZY	ostoba	 träge;   faul; dumm;  grob;  derb;   plump;  unwissend;  ungeschlacht;  blöd	  faul	faul-10
2029	1564	LAZY	pacuha	 träge;   faul;   schlampig;  Kram;  Plunder; Kleidungsstück;   weich;   Habseligkeiten	  faul	faul-11
2030	1564	LAZY	poshad	  faul;  faulenzen;  sauer werden; verfaulen;   abstehen;  verroten;  ausgären;  träge werden 〈Person〉;  schal werden 〈Flüssigkeit〉;  stinkig werden	  faul	faul-12
2031	1564	LAZY	puruttya ×	 Handlung〉;   faul;   schmutzig; ekelhaft;  liederlich;  sudelig;  scheußlich;  matschig;   garstig 〈Rede〉;  schändlich 〈Haltung;   ehrlos 〈Weibsperson〉	  faul	faul-13
2032	1564	LAZY	renyhe	 träge; faul;  Gestüt〉;   nicht für Zucht bestimmt 〈Pferde;   die Stimmung der Untätigkeit;  des trägen Wohlstan hervorrufend 〈Zustand. Gegenstand〉;   träge 〈physiologische Funktion〉	faul	faul-14
2033	1564	LAZY	rest	 träge;  faul;   sich schämen; arbeitsscheu;   zu faul sein;  etw zu tun;  ungern etw tun;   sich genieren;  sich genieren;   zu faul sein zu etw;  widerwillig sein	 faul	faul-15
2034	1564	LAZY	rothad	  faul;  zugrunde gehen; faulen;  siechen;   müßig sein;  verdorben;   verkommen;  Verderben;  zersetzt werden 〈abstr〉;   Fäulnis;   Fäulnis	  faul	faul-16
2035	1564	LAZY	rusnya	  faul;   schlampig; schmutzig;   häßlich;   ehrlos;  ekelhaft;   fehlerhaft;  scheußlich;  sittenlos	  faul	faul-17
2036	1564	LAZY	slampet ×	 träge; faul;  zerlumpt;   schlampig 〈haupts Frau〉	faul	faul-18
2037	1564	LAZY	susnya †	 träge;   faul;  zerlumpt; schmutzig;   aus dem Magen übel riechend;   furchtsames Kind	  faul	faul-19
2038	1564	LAZY	tohonya	 träge; faul;   plump;  groß	faul	faul-20
2039	1564	LAZY	tunya	träge;   faul;  dumm;   töricht;  plump;   leicht;  müßig;  untätig;   feige;   molett 〈Weib〉;  träge sein	  faul	faul-21
2040	1564	LAZY	záp¹	faul;  stinkend 〈Ei〉	faul	faul-22
2041	43	LEAD (GUIDE)	csá ×	hott bzw hü;   ein Tier treiben;  leiten;   mit einer Kurve od Kehre;   rechts;  links	 leiten	leiten-1
2042	43	LEAD (GUIDE)	vezet	 leiten;   lenken;   führen;  führen;   Lenker; begleiten;  führen 〈Weg;  Leiter von etw sein;   einen  Lebenswandel führen;  führen 〈Fahrzeug〉;   etw ergeben;  Pfad usw〉;   strömendes Material leiten;   voranstehen 〈Sport〉;   Familien- 〈Name〉;   geleitet 〈Pferd〉;   Handpferd;   Leitung 〈Technik〉	 leiten	leiten-2
2043	43	LEAD (GUIDE)	visel	  schwanger;   〈Krankheit;   besitzen;  haben;  leiten;  Bart〉;  Aufgabe〉;   führen;   beschimpfen;   〈als Folge〉 nach sich ziehen;   sich abtragen;  herabsetzen;   abgetragen;   besorgen; vollbringen 〈Sendung;  ein Amt innehaben;   tragen 〈eine Last〉;   ertragen 〈Unangenehmes〉;   eine Lebensweise führen od Haltung bezeigen;   tragen 〈Kleidungsstück usw〉;  tragen 〈Frisur;   schwanger sein;  Schlag usw〉 einen her-;  mitnehmen;   getragen werden;   ein Gefühl bezeigen;   an Arbeitstagen getragen 〈Kleidungsstück〉;   sich benehmen;  sich verhalten	 leiten	leiten-3
2044	43	LEAD (GUIDE)	folytat	 treiben;   fließen lassen; eilen;   führen;  ausüben;   fortsetzen	  führen	fuhren-1
2045	43	LEAD (GUIDE)	vesz	 gewinnen;  Getränk〉;   erwerben;  eindringen;  betrügen;   Einkommen;   sich einnisten;  nehmen;  Empfang;  Empfang;  führen;  erwägen;  Einnahme;    erscheinen;   entfernen;   anziehen;  bejahen;    bringen;   anerkennen;   Ausnahme;   Ausnahme; zu sich nehmen 〈Speise;  hinnehmen;   erhalten;   kaufen;   auf sich nehmen 〈Auftrag;  Verantwortung usw〉;   jmdn zu sich nehmen;   anfassen;  hochheben;  in Besitz nehmen;  erobern;   begreifen;  an etw teilhaben;    auffassen;  wegmachen;  sich etw umnehmen;  für Wahrheit halten;   umgeben 〈auch abstr〉;   zu etw bewegen;  sich ausnehmen;   Annahme;   Annahme;   gekündigter Betrag;   Aufnahme;   Begreifen;   Subtraktion;   Besonderes;   Käufer	 führen	fuhren-2
2046	43	LEAD (GUIDE)	vezényel	 befehlen;  lenken; führen;   kommandieren;  kommandieren;   beordern;   tatkräftig leiten;   dirigieren 〈Musik〉	führen	fuhren-3
2047	43	LEAD (GUIDE)	vezet	 leiten;   lenken;   führen;  führen;   Lenker; begleiten;  führen 〈Weg;  Leiter von etw sein;   einen  Lebenswandel führen;  führen 〈Fahrzeug〉;   etw ergeben;  Pfad usw〉;   strömendes Material leiten;   voranstehen 〈Sport〉;   Familien- 〈Name〉;   geleitet 〈Pferd〉;   Handpferd;   Leitung 〈Technik〉	  führen	fuhren-4
2048	43	LEAD (GUIDE)	vezet	 leiten;   lenken;   führen;  führen;   Lenker; begleiten;  führen 〈Weg;  Leiter von etw sein;   einen  Lebenswandel führen;  führen 〈Fahrzeug〉;   etw ergeben;  Pfad usw〉;   strömendes Material leiten;   voranstehen 〈Sport〉;   Familien- 〈Name〉;   geleitet 〈Pferd〉;   Handpferd;   Leitung 〈Technik〉	 führen	fuhren-5
2049	43	LEAD (GUIDE)	visel	  schwanger;   〈Krankheit;   besitzen;  haben;  leiten;  Bart〉;  Aufgabe〉;   führen;   beschimpfen;   〈als Folge〉 nach sich ziehen;   sich abtragen;  herabsetzen;   abgetragen;   besorgen; vollbringen 〈Sendung;  ein Amt innehaben;   tragen 〈eine Last〉;   ertragen 〈Unangenehmes〉;   eine Lebensweise führen od Haltung bezeigen;   tragen 〈Kleidungsstück usw〉;  tragen 〈Frisur;   schwanger sein;  Schlag usw〉 einen her-;  mitnehmen;   getragen werden;   ein Gefühl bezeigen;   an Arbeitstagen getragen 〈Kleidungsstück〉;   sich benehmen;  sich verhalten	  führen	fuhren-6
2050	43	LEAD (GUIDE)	visz	  ertragen;  ausführen;   führen;  verschleppen;   mit sich reißen;  in Besitz nehmen; hinschaffen;  weiterbefördern;  irgendwohin führen 〈Weg usw〉;  zu einer Folge herbeiführen;  begünstigen;  előmozdít;  elősegít;   belasten;   etw auf jmdn od etw beziehen;   davontragen 〈Lohn usw〉;   Tragen;   Umsiedeln	  führen	fuhren-7
2051	43	LEAD (GUIDE)	hoz	  erwähnen;  erreichen;   einholen;   bestimmen;    tragen; beibringen;  holen;  ergeben;  anführen;   zur Welt bringen;   ermöglichen;   publizieren;   auf Kredit	 anführen	anfuhren-1
2052	43	LEAD (GUIDE)	idéz	 vorladen;    richten;   beobachten;  zustande bringen;   hervorrufen;   anführen; vor Gericht zitieren;   in Erinnerung bringen;   erinnern;  schauen;  zitieren;   beschwören;   ladung;   Zitat;  wörtliche Anführung	  anführen	anfuhren-2
2053	628	LEAF	lap	 Karte;   Fläche 〈Geom〉; flache Klinge 〈Säbel〉;  Fläche 〈Messer〉;   flache Seite;   Seite 〈Buch〉;   Blatt;   Niederung;   Zeitung;   Platte	  Blatt	Blatt-1
2054	628	LEAF	lapu	   Blatt; 〈zur Benennung versch großblättriger Pflanzen;  haupts Klette und Wegerichgewächse〉;  Baumblatt	   Blatt	Blatt-2
2055	628	LEAF	levél	 Urkunde;  Zettel;   Blatt;   Zeitung; Brief;   Blatt einer Pflanze;   Adels-;  Freibrief usw;  Seite 〈im Buch〉;   dünne Metallplatte;  plattenförmiger Gegenstand;   Blätterteig;   Blätter treiben;   blättrig 〈Pfanze〉;   eines Verbrechens verdächtigt;  brieflich verfolgt;   entblättern;  Triebe entfernen;   Briefwechsel führen	  Blatt	Blatt-3
2056	504	LEARN				
2057	2959	LEASH				
2058	629	LEATHER	bőr	Leder;   Haut;  Fell;   Fruchthülle;   Haut 〈auf der Milch〉;   Haut 〈auf der Milch〉;   Weib 〈in sexueller Beziehung〉;   Ball 〈im Fußball〉	Leder	Leder-1
2059	629	LEATHER	bőrönd	  Leder; Koffer;   Rucksack	  Leder	Leder-2
2060	629	LEATHER	harisnya	Strumpf;  Strumpf ;   Leder;   eng anliegende Hose aus  Turch;   eng anliegende Hose aus weißem Turch;  das oberhalb des Bunchuhes um das Bein gewickelt wird;   Glühkörper des Gaslichts	  Leder	Leder-3
2061	629	LEATHER	szíj	  Riemen;   Leder-; Streifen;  Seil;   Band	  Leder-	Leder-4
2062	1752	LEAVE	árva	Waise;   einsam;  verlassen;   verwitwet;   elternlos	 verlassen	verlassen-1
2063	1752	LEAVE	hagy	  verkaufen;   Tradition;   genehmigen;   anvertrauen;   anvertrauen; verlassen;  überlassen;  überlassen;   nachlassen;   befehlen;  bewilligen;  geschehen 〉;   lassen 〈etwas tun;   vererben;  hinterlassen;  anordnen;   jemanden oder etwas in demselben Zustand;  an demselben Ort lassen;   mit einer Sache aufhören;  bleiben lassen;   aufschieben;   aufschieben;  übriglassen;  übriglassen;   Spur usw. hinterlassen;  zulassen;   Verlassung;  Scheidung;   Nachlaß;  örökhagyó;  tradicionális;   das Lassen;  maradék;  valakinek a halála után maradt vagyon	verlassen	verlassen-2
2064	1752	LEAVE	özvegy	 einsam;   verlassen;   verwitwet;   unverheiratet;  verwaist; Witwe	  verlassen	verlassen-3
2065	1752	LEAVE	puszta	 verlassen;   verlassen;  nur;  alleinig;   einfach;   bloß;   bloß;  wüst; öde;  Wüste;  großes Landgut;   Meierhof;   unverheiratet 〈weibliche Person〉;   rein;   unbebaut;  brachliegend 〈Feld;  Nutzland〉;   unbedeckt;   Art Steppe;  Pußta;   Einöde;   unverziert gelassener teil von etw	 verlassen	verlassen-4
2066	1752	LEAVE	puszta	 verlassen;   verlassen;  nur;  alleinig;   einfach;   bloß;   bloß;  wüst; öde;  Wüste;  großes Landgut;   Meierhof;   unverheiratet 〈weibliche Person〉;   rein;   unbebaut;  brachliegend 〈Feld;  Nutzland〉;   unbedeckt;   Art Steppe;  Pußta;   Einöde;   unverziert gelassener teil von etw	  verlassen	verlassen-5
2067	1752	LEAVE	szív¹	  rauchen;   Regenbogen;   Heber; saugen;   verschwinden;   sich schneuzen;   ziehen;   ausrollen;   einsaugen;   sich betrinken;   schikanieren;  verschlingen;  Beschwerde〉;   trocken werden;   einatmen;   aufschnupfen;   entnehmen;   zurücknehmen 〈Behauptung;   in den Zähnen herumsaugen;  im Ärger die Luft durch die Zähne einziehen;  schnupfen;  ausziehen 〈Teig〉;   die Farbe ausziehen;   sickern;   sickern;   Schwamm;   pumpen;   Pumpe;   aufgesogen werden;  weggehen	 weggehen	weggehen-1
2068	244	LEFT	csá ×	hott bzw hü;   ein Tier treiben;  leiten;   mit einer Kurve od Kehre;   rechts;  links	 links	links-1
2069	1297	LEG	csont	  Mensch; Knochen;  Bein;  Kerl 〈scherzhaft〉	 Bein	Bein-1
2070	1297	LEG	ín²	  Ranke; Bein;   stark;   Ader;  Rachen;   Seil;   Bogensehne;   Nerv;  Wade;   Sehne;  Flechse;   Muskel;   Gaumen;   flechsig	Bein	Bein-3
2071	1297	LEG	láb	Fuß;  Fuß;   Schuh;   Bein;  Sok-kel;   Ende bzw irgendein Teil eines Gruntückes;   Fuß 〈Längenmaß〉;   Stamm des Baumes;   der Mensch selbst;   Versfuß	  Bein	Bein-5
2072	2537	LENGTH	hosszú	lang 〈räumlich〉;   lang 〈zeitlich〉;   umfangreich;   Länge;   verschieben;   sich verlängern;   lange;   längs	  Länge	Lange-1
2073	1612	LETTER	levél	 Urkunde;  Zettel;   Blatt;   Zeitung; Brief;   Blatt einer Pflanze;   Adels-;  Freibrief usw;  Seite 〈im Buch〉;   dünne Metallplatte;  plattenförmiger Gegenstand;   Blätterteig;   Blätter treiben;   blättrig 〈Pfanze〉;   eines Verbrechens verdächtigt;  brieflich verfolgt;   entblättern;  Triebe entfernen;   Briefwechsel führen	Brief	Brief-1
2074	319	LICK	folyik	  Bett;  Graben;  Efeu;   brünstig sein;   Kurier;   entstehen;   Fluß;   Fluß;  folgen; fließen;   fließen;  schwimmen 〈Schiff〉;  fahren 〈im Boot〉;  zirkulieren;   gehen;  laufen;   laufen;  laufen;   rinnen;  ausgestreut od ausgeschüttet werden;   durchdringen;   vergehen 〈Zeit〉;   die Worte fließen ihm od ihr aus dem Munde;   hinaufklettern;   löschen 〈Papier〉;  überlaufen 〈Tinte〉;   vonstatten gehen;   lecken 〈Gefäß〉;   in Umlauf sein 〈Geld〉;  entsprießen;  hervorgehen;   sich verwischen;   schnell schreibende Person;  Bote;   vor jmdn treten;   Ausfluß;   lauf;  lauf;  Gang 〈auch abstr〉;  begehren;   fließen lassen;  lecken;   schnell herumgehen;   gang;  Kurs;   Wasserabfluß;   Flüssigkeit;   Flüssigkeit;   Folge;   Folge;   Kletterpflanze;   fort und fort	 lecken	lecken-1
2075	319	LICK	nyal	 Getränk〉;   schmeichlerisch; lecken;  saufen;  schlecken;   umschmeicheln;  umbuhlen;   sich schmecken lassen 〈Wein;   küssend liebkosen;  abschmatzen;   naschhafter;  wichtigtuender Nichtstuer;   Stielbonbon	lecken	lecken-2
2076	2319	LID (COVER, CAP)	borít	  sich begatten; hüllen;   umstoßen;  ausgießen;   überfluten;  versenken;   in irgendeinen Zustand versetzen;   Deckel;   Kuvert	  Deckel	Deckel-1
2077	2319	LID (COVER, CAP)	fed	  Deckel;   schützen;   Topf; decken;   〈die Kosten〉 decken;   sich zudecken;   Verborgenheit;   Deckung 〈im Bankwesen〉;   Läufer;   Deck;   Deckung 〈milit〉	  Deckel	Deckel-2
2078	2319	LID (COVER, CAP)	fedél	  Decke;   Schutz;   Deckel;   Deck;   Deck; Dach;   dachen;   Dachung	  Deckel	Deckel-3
2079	2319	LID (COVER, CAP)	kúp	  Kegel;   Deckel; Haufen bzw die Spitze eines Haufens od eines Gegenstandes;  Konus;   Kuppel;   Zäpfchen;  Suppositorium	  Deckel	Deckel-4
2080	2319	LID (COVER, CAP)	sátor	  Laubhütte;   Deckel; Zelt;  Gartenlaube;  Kuppel;  ein gewisser Teil des Schädels;   Führerstand auf der Lokomotive	  Deckel	Deckel-5
