ID	CONCEPTICON_ID	CONCEPTICON_GLOSS	FORM	MEANING	SENSE	SENSE_ID
1002	485	DISAPPEAR	enyészik	 klein;  sich verbergen;   verbergen; verschwinden;   schwach werden;  kraftlos werden;   verwesen;  vernichtet werden;   Sonnenuntergang;   Verfall;   verschwindend wenig	verschwinden	verschwinden-1
1003	485	DISAPPEAR	illik² ∆	verschwinden;   laufen;   zerfallen;   duften;  verstauben	verschwinden	verschwinden-2
1004	485	DISAPPEAR	kallódik	  verschwinden; schwinden;  allmählich ausgehen;  abgehen 〈Ware〉;   gestoßen od herumgeworfen werden;   durch Walken verfilzt werden;   beschädigt werden;  abhanden kommen;  verlorengehen;   im Leben nicht zurechtkommen 〈Person〉	  verschwinden	verschwinden-3
1005	485	DISAPPEAR	kel¹	  Ursprung;  wandern;   entstehen;   entstehen;   aufgehen 〈Teig〉;   Datum;  verschwinden; gehen;   verlorengehen;   angreifen;  stammen;  herauskommen;   aufstehen;  erwachen;   aufkeimen;   aus dem Ei schlüpfen;   aufgehen 〈Gestirn〉;   sich aufmachen 〈etw zu tun〉;  sich empören;   wieder zu Kräften kommen;    wurde ausgestellt;  gegeben;   ausgehen 〈Geld;  Vorrat〉;  wachsen 〈Geschwür〉;   nötig sein;   abbauen;  fördern 〈Bergbau〉;   ausbrütten;   Übergangsstelle;   gängig;   auszustellend;  zu fertigend 〈Akte〉;   Gebürh 〈Betrag〉	 verschwinden	verschwinden-4
1006	485	DISAPPEAR	sudamlik ∆	 verschwinden;   schleichen; entfliehen;  schlüpfen;   huschen	 verschwinden	verschwinden-5
1007	485	DISAPPEAR	szív¹	  rauchen;   Regenbogen;   Heber; saugen;   verschwinden;   sich schneuzen;   ziehen;   ausrollen;   einsaugen;   sich betrinken;   schikanieren;  verschlingen;  Beschwerde〉;   trocken werden;   einatmen;   aufschnupfen;   entnehmen;   zurücknehmen 〈Behauptung;   in den Zähnen herumsaugen;  im Ärger die Luft durch die Zähne einziehen;  schnupfen;  ausziehen 〈Teig〉;   die Farbe ausziehen;   sickern;   sickern;   Schwamm;   pumpen;   Pumpe;   aufgesogen werden;  weggehen	  verschwinden	verschwinden-6
1008	485	DISAPPEAR	tenyészik	 Zustand;  Tier;  Haltung〉;  verursachen;   Zucht;   leben;   verschwinden;   sich mehren;   züchten; befruchten;  fruchtbar sein;  gedeihen 〈Pflanze;  vormals auch Mensc〉;   zu sich kommen;   sich ausbreiten 〈Ausschlag〉;  verblühen;   im Schwange sein 〈Gewohnheit;   sich breitmachen;   bewirken;   weiblich 〈Tier〉;   als Zuchttier gehalten;   seine Zucht vermehren 〈Weibchen eines Tieres〉;   Tiere züchten;   Fruchtbarkeit;  Kultur 〈Biol〉	  verschwinden	verschwinden-7
1009	485	DISAPPEAR	tűnik	 sich auszeichnen;   verschwinden;  vernichtet werden;   ausgezeichnet;   sich in jmdn vernarren;   erscheinen;   Symptom;   Erscheinung;   Vorzugsschüler;  verlorengehen;   Vision;   herausragend;   vergehen;  großartig;  sichtbar werden; einem in den Sinn kommen;  es dünkt einem;   sich verwandeln;  auftauchen;   hineingelangen;   auffallen;   nichtschauen 〈beim Versteckspiel〉;   Anschein;   sich zeigend;  sich offenbarend;   Vorzüglich 〈als Schulnote〉	  verschwinden	verschwinden-8
1010	1986	DISEASE	baj	  Angelegenheit; Kampf;  Zweikampf;   Ort des Zweikampfes;   Sorge;   Beschwerlichkeit;  Plackerei;   Krankheit;  Defekt;   Menstruation;   Notdurft;   Hinderniss	  Krankheit	Krankheit-1
1011	1986	DISEASE	dög	  zugrunde gehen; Krankheit;  kaputtgehen;   sehr;   zugrunde richten;  Seuche;   Leiche;   Aas;   lebendes Tier 〈bes Hund;  Pferd〉;   niederträchtiger Mensch;   Unmenge;   Prachtweib;   Bestie;   in Versuchung bringen;   zunichte werden;   Schinder;   Mediziner	Krankheit	Krankheit-2
1012	1986	DISEASE	kór	  Krankheit;   Krankheit; krank;   krank werden;   kranker Mensch;  Leiden	  Krankheit	Krankheit-4
1013	1986	DISEASE	kór	  Krankheit;   Krankheit; krank;   krank werden;   kranker Mensch;  Leiden	  Krankheit	Krankheit-5
1014	1986	DISEASE	lel	  Krankheit;   krank;   erkranken;   treffen;   suchen;   Fieberfrost; finden;   Erfindung;   das Fieber schüttelt einen;  jmdm geschehen;  um etw bitten;   Finden;   Befund 〈Med〉;   Fund 〈Archäologie〉	  Krankheit	Krankheit-6
1015	1986	DISEASE	nehéz	 unbeholfen;  schwanger;   schwanger;   Krankheit;  Last;   krank;   Schwierigkeit;   schwerfallig; schwer;  unangenehm;   Gesäß;   Art Münzeinheit;   Gewicht;   mühselig;   drückend;   unverträglich;   Schwere;   jmdm grollen	  Krankheit	Krankheit-7
1016	1986	DISEASE	nyavalya	  niederträchtig;  Beschwerlichkeit;   Krankheit;  Elend;   〈als Schimpfw〉;  plagen;   kränken;   kränklich;   Übel; Not;   lamentieren;  Bedarf;  Epilepsie;   mißlich;  elendig;  verächtlich;   in elendiger Lage sein;   bedrücken;   jm unglückliches Schicksal;   in eine unglücke Schicksal;   Unglückliche	  Krankheit	Krankheit-8
1017	481	DISH				
1018	2978	DISTANCE				
1019	2883	DISTURB	bizgat ×	 aufwiegeln; berühren;  bewegen;   reizen;  ärgern;   stören;  aufstöbern;   anregen	  stören	storen-1
1020	2883	DISTURB	bódít	belästigen;  beschwindeln;  stören;   jmdn um den Verstand bringen;   betäuben;  abmatten	 stören	storen-2
1021	2883	DISTURB	habar	 belästigen;   plappern;   stören;  beschleunigen;   sich in jmdn vernarren; quirlen;  umtühren 〈in eine Speise〉 einrühren;   sich beeilen;  blubbern;  kavarófa;  a ló felső ajka;  száj;   sich streiten	  stören	storen-3
1022	2883	DISTURB	háborgat	 beunruhigen;  belästigen; stören;   aufrühren〈Wasser〉	stören	storen-4
1023	2883	DISTURB	háborít	 beunruhigen;  beunruhigen;  belästigen;  belästigen;  ärgern;  ärgern; stören;   stören;  zornig machen;  zornig machen;   wogen lassen;  hochgehen lassen;   Überkeit verursachen	stören	storen-5
1024	2883	DISTURB	háborít	 beunruhigen;  beunruhigen;  belästigen;  belästigen;  ärgern;  ärgern; stören;   stören;  zornig machen;  zornig machen;   wogen lassen;  hochgehen lassen;   Überkeit verursachen	  stören	storen-6
1025	2883	DISTURB	habuckol	 stören; herumzappel;  im Wasser plätschern;   mit der Fischtrampe trüben	 stören	storen-7
1026	2883	DISTURB	interpellál	stören;   auffordern;   eine Interpellation an die Regierung richten	stören	storen-8
1027	2883	DISTURB	noszogat	 belästigen;   stören;  antreiben; ermuntern	  stören	storen-9
1028	2883	DISTURB	zavar	 beunruhigen;   umrühren;   stören;   treiben;  verwirren;  vermischen; trüben 〈Flüssigkeit〉;  verjagen	  stören	storen-10
1029	119	DIVE	bújik	  Vorwand; sich verbergen;   hineindringen in etw;   tauchen;   sich in etw vertiefen;   schlüpfen 〈in ein Kleidungsstück〉;   aufgehen 〈Pflanze〉;   Verbannter;   Ausweg	  tauchen	tauchen-1
1030	119	DIVE	bukik	 stürzen;   fallen; tauchen;   eine Niederlage erleiden;   auf etw stoßen;   die führende Rolle verlieren;   fallieren;   zu Fall kommen;   durchfallen 〈in einem Unterrichtsfach〉;   der Polizei in die Hände fallen;   erpicht sein	tauchen	tauchen-2
1031	119	DIVE	márt	tauchen;    ziehen;   Soße;  tunken;   sich unbefugt in etw einmischen;   stoßen 〈Messer;  Stichwaffe〉;    waschen;   Tauchen;  Tunken	tauchen	tauchen-3
1032	119	DIVE	márt	tauchen;    ziehen;   Soße;  tunken;   sich unbefugt in etw einmischen;   stoßen 〈Messer;  Stichwaffe〉;    waschen;   Tauchen;  Tunken	  Tauchen	Tauchen-1
1033	1119	DIVIDE	szakaszt	 absondern; zerfressen;   nehmen;   hinrichten;  verätzen;   reißen 〈trans〉;   entzweien 〈Gemeinschaft〉;  teilen;   ein Ende machen;  unterbrechen;   pflücken 〈Obst;  Blume〉;   〈Brotteig〉 auswirken;   erübrigen 〈Zeit〉;   Backkorb;  szakított;  tépett;   ganz ähnlich	 teilen	teilen-1
1034	813	DO	cihődik ×	sich langsam aufrappeln;  etw langsam ausführen;  tun	 tun	tun-1
1035	813	DO	cihelődik	sich unruhig benehmen;   sich langsam aufrappeln;  etw langsam ausführen;  tun	 tun	tun-2
1036	813	DO	cselekedik	 tun; handeln	 tun	tun-3
1037	813	DO	csinál	 verfertigen; herstellen;  stellen;   tun;   entstehen;  errichten;   ausbessern;  machen;   hecheln;   legen;   zeugen;  beischlafe 〈in euphem Ausdrücken〉;   verursachen;   Schein-;  erkünstelt	  tun	tun-4
1038	813	DO	eszköz	Werkzeug;  Gerät;   Mittel;  tun;   machen;   ausführen	 tun	tun-5
1039	813	DO	követ	  fordern;   fordern;   tun;  machen; folgen;   folgen;   erreichen;   mieten;   Anhänger;   Anzeichen;  zufallen;   fragen;  begleiten;  verlangen; Abgesandter;  Sendbote;   Gesandter;  Botschafter;   Abgeordneter;   Sendung;  Auftrag;  Mission;  Botschaft;  Botschaft;   Abordnung;   Gesandtschaft;   nachmachen;   folgen 〈in der Zeit〉;   versöhnen;  betreiben 〈Gewerbe〉;   folgend;   befolgenswerf;   Befolgung;  Folgen;   fordernd;   als Folge nach sich ziehen;   folgern	  tun	tun-6
1040	813	DO	pepecsel	 ungeschickt; langsam;  tun;  erfolglos machen;   gertikulieren;   verpanschen	 tun	tun-7
1041	2009	DOG	cenk ∆	  schuftig;   Rekrut; hund;   Stalljunge 〈bes beim Milit〉;  junger Söldner;   Knabe;  bengel;   Schuft;   jung	hund	hund-1
1042	2009	DOG	csille	  Floß;  -hund; leichter Wagen;   Wagenladung;   Heuhaufen;  Kahn;   Förderwagen	 -hund	hund-2
1043	2009	DOG	eb	Hund;   niederträchtiger Kerl;   Hunde-;  Hun-;  hündisch	Hund	Hund-1
1044	2009	DOG	fakó	Hund;   Falbe;   fahl;   unbeschlagen 〈Wagen〉;   unverziert;  unscheinbar	Hund	Hund-2
1045	2009	DOG	guba¹ ∆	 Flaus;   Hund; zottiger Obermantel aus Wolle;   Flaus tragend	  Hund	Hund-3
1046	2009	DOG	kutya	  schuftig;  niederträchtig;   sehr;   Art Kartenspiel;   Förderwagen;  Detektiv;   Hund; niederträchtiger Kerl;   Trabant in ungarischer Tracht;   Hündchen;   〈zur Benennung versch Geräte;  Bestandteile〉;   niemand;  nichts;  außerordentlich schlecht;   streng 〈Pflicht〉	  Hund	Hund-4
1047	1659	DOLL	alak¹	  Gestalt; Puppe;  Docke;   Maske;   Liebchen;  Form;   verziert;   Gaukler;  Komödiant 	Puppe	Puppe-1
1048	1659	DOLL	bábu	Puppe;   Kegel;  Figur 〈in versch Spielen〉;   Marionette 〈pejor〉 	Puppe	Puppe-2
1049	1659	DOLL	buba ×	Puppe	Puppe	Puppe-3
1050	1659	DOLL	váz	  Puppe;  Gerüst;  Gespenst;   Gestell; Vogelscheuche;  Figur;  Popanz;   Schreckgestalt;   Skelett;   Schema;  Gedankengang	  Puppe	Puppe-4
1051	196	DONATE	ad	zukommen lassen;  schenken;   geben;  liefern;   lassen;   verkaufen;   veröffentlichen;   Geben;   Beleg;  Angabe;   Gesetzgeber;   Herausgeber;   〈als Teil eines Schimpfw〉;   Tradition;   Beitrag 	 schenken	schenken-1
1052	1567	DOOR	ajtó	Tür; Tür;  ajtóőriző;   öffnen	Tür	Tur-1
1053	1567	DOOR	ajtó	Tür; Tür;  ajtóőriző;   öffnen	Tür	Tur-2
1054	1567	DOOR	porta	 Tür;   Grunteuer; Tor;   die  Pforte;    Liegenschaft;   vom Pförtner bewachter Eingang;  Pförtnerloge;   Haus und Hof besitzend;   Hofbauer;   Gesandter zur Hohen Pforte;   Pförtner	 Tür	Tur-3
1055	1326	DOWN	alá	abwärts;   unten;   darunter;   hinunter;   für;   unterhalb 	abwärts	abwarts-1
1056	1326	DOWN	fityeg	 herabhängen;  bummeln; hinab-;   die Daumen drehen;   hängender Schmuck;  Ohrring	hinab-	hinab-1
1057	1326	DOWN	le	  nieder mit ihm;   unten;  hinunter;  hinunter; ab;   ab;  her-;  her-;  her-;  her-;  hinab;  hinab;   auf eine niedrigere Stufe 〈in der Rangordnung〉;  herunter damit	 hinab	hinab-2
1058	1326	DOWN	le	  nieder mit ihm;   unten;  hinunter;  hinunter; ab;   ab;  her-;  her-;  her-;  her-;  hinab;  hinab;   auf eine niedrigere Stufe 〈in der Rangordnung〉;  herunter damit	 hinab	hinab-3
1059	2030	DRAG	hercehurcál ×	belästigen;   verleumden;  bloßstellen;  ein Gerücht umherbringen;    schleppen	   schleppen	schleppen-1
1060	2030	DRAG	hord	   ertragen;  schleppen; tragen;    tragen;   ähneln;  gleichen;    verbreiten;   umherbringen;   tragen 〈Schußwaffe〉;   im Leibe tragen 〈Schwangere die Frucht〉	 schleppen	schleppen-2
1061	2030	DRAG	hurcol	  schleppen;  verschleppen;   verunglimpfen;   herumtragen	  schleppen	schleppen-3
1062	2030	DRAG	húz	  sich sträuben;   zanken; zerren;   zerren;  Zug;   Überzug;  schleppen;   ziehen;   ziehen;  entfernen;    spannen;  spannen 〈Strang;  Draht usw〉;   anziehen;   anziehen;   ziehend befördern;   in die Länge ziehen;   beziehen 〈Einkommen〉;  überziehen;   ziehen 〈Luftzug〉;   auf einem Streichinstrument spielen;   bewegen 〈auf einer Fläche〉;  eine Linie ziehen;   jmdm einen Schlag versetzen;   aufziehen;  aufziehen;  aufstocken 〈Bauwesen〉;   jmdm zugeneigt sein;  zu jmdm halten;   herausheben;  eine Ziehung vornehmen;   ziehen 〈intrans〉;   einen Zug tun;   nekken;   Fahrt;   sich strecken;   sich strecken;   〈unbest Bed〉;   anhaltend;   Ziehen;   Zugluft;   Abzugshahn;   wachen	 schleppen	schleppen-4
1063	93	DRAW MILK	fej¹	  saugen; melken;   abdringen 〈Geld〉	melken	melken-1
1064	2374	DREAM	álom	Traum;   Schlaf;   Einschlafen 	Traum	Traum-1
1065	814	DRESS UP	öltözik	 Hülle;   Kleidung;   Ankleideraum; sich kleiden;   eine bestimmte Art Kleidung tragen;   in einen geistlichen Orden eintreten;   ankleiden;   einen charakteristischen Zug;  eine Eigenschaft annehmen;   sich verkleiden	  ankleiden	ankleiden-1
1066	1401	DRINK	iszik	 Getränk;   Getränk;   Kneipe;   Trunkenbold;   flüssig;   vor Durst; trinken;    in sich ziehen;   einsaugen;   gierig genießen;   trunksüchtig sein;   die Linie berühren;  auf die Linie fallen 〈in manchen Spielen〉;   Tränke;   Tränke;   Trinken;   Trinken;   Trinker;  ohne Trinken;   angeheitert;  betrunken;   Lösch-;   Fließpapier	trinken	trinken-1
1067	1401	DRINK	piál	 trinken	 trinken	trinken-2
1068	1401	DRINK	iszik	 Getränk;   Getränk;   Kneipe;   Trunkenbold;   flüssig;   vor Durst; trinken;    in sich ziehen;   einsaugen;   gierig genießen;   trunksüchtig sein;   die Linie berühren;  auf die Linie fallen 〈in manchen Spielen〉;   Tränke;   Tränke;   Trinken;   Trinken;   Trinker;  ohne Trinken;   angeheitert;  betrunken;   Lösch-;   Fließpapier	  Trinken	Trinken-1
1069	1401	DRINK	iszik	 Getränk;   Getränk;   Kneipe;   Trunkenbold;   flüssig;   vor Durst; trinken;    in sich ziehen;   einsaugen;   gierig genießen;   trunksüchtig sein;   die Linie berühren;  auf die Linie fallen 〈in manchen Spielen〉;   Tränke;   Tränke;   Trinken;   Trinken;   Trinker;  ohne Trinken;   angeheitert;  betrunken;   Lösch-;   Fließpapier	  Trinken	Trinken-2
1070	741	DRIVE	dirigál	lenken;  richten;   verwalten;  Befehle austeilen;   dirigieren 〈einen Chor;  ein Orcheste〉	lenken	lenken-1
1071	741	DRIVE	fordít	 lenken;  richten;   benützen; bekehren;   kehren;  wenden;   ändern;    umwenden;   vergüten;  ersetzen;   übersetzen;  übertragen;   umdrehen;  verwenden;   auf etw beziehen;   Wendung;   Übersetzung;   Türangel;   Übersetzer	 lenken	lenken-2
1072	741	DRIVE	kanyarít	  flunkern;   schleudern;   lenken;   werfen;   schreiben; entwenden;  abwenden;   beugen;  eine bogenförmige Figur machen;   bogenförmig abschneiden;  schweifen;  Umschweife machen 〈in der Erzählung〉	  lenken	lenken-3
1073	741	DRIVE	kéz	  lenken;  nachgiebig; Hand;   freundlich;   mit der Hand etw vorzeichnen;  eine Gebärde tun;  betätigen;   Manipulant	  lenken	lenken-4
1074	741	DRIVE	kormány	Steuer;    regieren;   Herrschaft;  Macht;    lenken;   Gutsverwalter;  Lenkvorrichtung;   Regierung 〈als Kabinett〉;   Streichblech;   Gouverneur	   lenken	lenken-5
1075	741	DRIVE	térít	   lenken;   bekehren;   vergüten;   verändern; zurücktreiben 〈Tier〉;   sich zu jmdm wenden;   abwendig machen;  von etw abbringen;   ablenken;   jmdn zu Verstand bzw zur Besinnung bringen	   lenken	lenken-6
1076	741	DRIVE	utal	 lenken;   verschieben;   fahren;  andeuten; 〈den Weg〉 durchlegen;   weisen;   sich auf jmdn od etw berufen;   verweisen an jmdn od etw;   auf etw hinweisen;   den Weg bereiten;   anweisen;   auf jmdn od etw angewiesen sein	 lenken	lenken-7
1077	741	DRIVE	utasít	 stellen; lenken;  anordnen;   einreihen;  anweisen;  jmdm den Weg weisen;   unterweisen;   anmahnen	lenken	lenken-8
1078	741	DRIVE	vezényel	 befehlen;  lenken; führen;   kommandieren;  kommandieren;   beordern;   tatkräftig leiten;   dirigieren 〈Musik〉	 lenken	lenken-9
1079	741	DRIVE	vezet	 leiten;   lenken;   führen;  führen;   Lenker; begleiten;  führen 〈Weg;  Leiter von etw sein;   einen  Lebenswandel führen;  führen 〈Fahrzeug〉;   etw ergeben;  Pfad usw〉;   strömendes Material leiten;   voranstehen 〈Sport〉;   Familien- 〈Name〉;   geleitet 〈Pferd〉;   Handpferd;   Leitung 〈Technik〉	  lenken	lenken-10
1080	741	DRIVE	kaptat	jmdn an etw gewöhnen;   bergauf gehen;  bergauf treiben;  fahren;   jm Lage aufbessern;  zur Genesung;  Erstarkung verhelfen;   steile Stelle	 fahren	fahren-1
1081	741	DRIVE	megy¹	  Gang;  Gang;   Gang;  Ufer;   schicken;   gehen;  vergehen 〈Zeit;    vonstatten gehen;   Platz;  vor etw;   Gehen;   abgehen 〈Ware〉;  fahren;   marschieren; verlaufen;  führen 〈Weg;  Fluß usw〉;  in Gang kommen usw 〈Lebewesen;  Fahrzeug〉;   gelangen 〈Gegenstand〉;   verschwinden 〈etw Zeitweiliges〉;  Dauer〉;  im Gang;  Betrieb sein;  Raum haben;  hineinkönnen;  hinpassen;  aufgehen 〈Menge〉;   zu etw passen;   Gelände entlang;  Wegrand;   beim Gehen;  auf dem Hinweg;   Zug 〈Gruppe〉;  elmenetelemkor;   Bedürfnis zu gehen;  Fortwollen	 fahren	fahren-2
1082	741	DRIVE	ország	  regieren;   Herrschaft;   Herrschaft; Land;  Reich;  fahren;  Bevölkerungeines Landes;  Regierungsgewalt;   gesetzgebende Körperschaft;   herumreisen	 fahren	fahren-3
1083	741	DRIVE	utal	 lenken;   verschieben;   fahren;  andeuten; 〈den Weg〉 durchlegen;   weisen;   sich auf jmdn od etw berufen;   verweisen an jmdn od etw;   auf etw hinweisen;   den Weg bereiten;   anweisen;   auf jmdn od etw angewiesen sein	  fahren	fahren-4
1084	2868	DRIVE (CATTLE)	csap¹	  lassen; schlagen;  Unterhaltung〉;   Dolch;  stibitzen;   hauen;   streichen 〈Maß〉;   zupfen 〈Wolle〉;  reißen;   schleudern;  hinstoßen;   dringen;   tünchen;   eine andere Richtung einschlagen;   herabschießen auf etw;   schmeicheln;   treiben;   veranstalten 〈Festmahl;  Lärm schlagen;   klauen;   Schlag;   Unglück;   Spur;   gedrückt voll 〈Maß〉;   um sich herumschlagen;   neckisch;   Flattergeist	  treiben	treiben-1
1085	2868	DRIVE (CATTLE)	folytat	 treiben;   fließen lassen; eilen;   führen;  ausüben;   fortsetzen	 treiben	treiben-2
1086	2868	DRIVE (CATTLE)	hajkurász	 hetzen ;  jagen; treiben	treiben	treiben-3
1087	2868	DRIVE (CATTLE)	hajt²	 bewegen;   dringen;   treiben;  antreiben;  antreiben;  sich abrackern;   Viehtreiber; in Bewegung setzen;  halten;   zu etwas bewegen;   〈Schulden〉 eintreiben;   einbringen;   〈eine Maschine〉in Betrieb halten;   〈Darminhalt;  Urin〉abführen;   fahren〈als Transitiv〉;  fahren 〈als Intransitiv〉;   sich strapazieren;  sich schinden;  állatterelő;  hajcsár;   Kutscher	  treiben	treiben-4
1088	2868	DRIVE (CATTLE)	kerget	  belästigen; treiben;  jmdm nachsetzen;   hineinzwängen;   trachten;  verfolgen;   hin und her rennen;  herumtollen;   zusammenplappern	treiben	treiben-5
1089	2868	DRIVE (CATTLE)	téreget ∆	treiben;   drehen;   bekehren 	treiben	treiben-6
1090	2868	DRIVE (CATTLE)	ver	prügeln;  schlagen;  schlagen;  zanken;   Bündel;  stoßen;   Prügel;   Prügel;   treiben;   drehen;   stechen;   niederwerfen;   klopfen;   hämmern;  vernichten;   bestrafen;  flechten;   Strafe;   kämpfen;   Gepräge;   Hammer;  Schweiß〉;  niederschlagen;   pochen;   schlagen 〈Naturerscheinung〉;  durch Schlagen Töne erzeugen;  in einen Zustand bringen;   anschlagen 〈Schaum;  seilen;   an etw befestigen;  klopfen 〈Herz〉;   mit dem bösen Blick treffen;   Schlagen;   Niedergeschlagenheit;   Niederlage;   mit Kanonen beschießen;   sich mit jmdm raufen	  treiben	treiben-7
1091	2868	DRIVE (CATTLE)	zakatol	 belästigen; treiben;  lärmen;   stottern;   klopfen	treiben	treiben-8
1092	2868	DRIVE (CATTLE)	zavar	 beunruhigen;   umrühren;   stören;   treiben;  verwirren;  vermischen; trüben 〈Flüssigkeit〉;  verjagen	  treiben	treiben-9
1093	3748	DROP (OF A LIQUID)	csepp	Tropfen;   ein Bißchen;   Tupfen	Tropfen	Tropfen-1
1094	3748	DROP (OF A LIQUID)	cseppen	  Tropfen; 〈einmal〉 tropfen;   es fällt für ihn etw ab;   hineinfallen	  Tropfen	Tropfen-2
1095	2866	DROP (SOMETHING)	ejt	  verursachen; zu Fall bringen;  im Kampf fällen;   in einen Zustand versetzen;   fallenlassen;   aussprechen;   sieben;   bei jmdm od an etw vorbeikommen	  fallenlassen	fallenlassen-1
1096	2866	DROP (SOMETHING)	esik	  ungeschickt;   Fall;   〈in einen Zustand〉 kommen;  flehen;  Maß〉;  stürzen; fallen;  fallen;   es regnet;  liegen;   fallen lassen;   Sonnenuntergang;   befallen;  bedecken;  geraten;   geschehen;   auf die Knie fallen;   den Tod finden;  es schneit;  es hagelt usw;   jmdm zuteil werden;   〈einem irgendwie〉 schmecken;  behagen;   sein;   hineindrängen;   sich auf jmdn stürzen;   sich erbarmen;   abnehmen 〈Menge;   Kasus;   ohne Fall;   vergänglich	  fallen lassen	fallenlassen-2
1097	2866	DROP (SOMETHING)	hull	 einstürzen;   Fallen;   fallen lassen;   verfallen; in dichten Tropfen herabfallen;  abfließen;   herabfallen;  wiederholt od dauernd fallen;   sich auf das Gesicht werfen;  einen Kniefall  tun;   ausfallen 〈Haar;  Gefieder usw〉;  zerfallen;  in Stücke gehen;  széjjeltörik;  szétesik;    umkommen;  im Kampfe fallen;  eingehen 〈Tier〉;   Streuen;  Fallenlassen;  lehullása közben;  lehullásakor	  fallen lassen	fallenlassen-3
1098	2866	DROP (SOMETHING)	hull	 einstürzen;   Fallen;   fallen lassen;   verfallen; in dichten Tropfen herabfallen;  abfließen;   herabfallen;  wiederholt od dauernd fallen;   sich auf das Gesicht werfen;  einen Kniefall  tun;   ausfallen 〈Haar;  Gefieder usw〉;  zerfallen;  in Stücke gehen;  széjjeltörik;  szétesik;    umkommen;  im Kampfe fallen;  eingehen 〈Tier〉;   Streuen;  Fallenlassen;  lehullása közben;  lehullásakor	 Fallenlassen	Fallenlassen-1
1099	1398	DRY	faré ×	mulmiger;  morscher Teil des Baumes;   trocken;  holzartig;  schwer zu verschlucken;  unschmackhaft	  trocken	trocken-1
1100	1398	DRY	ösztövér	 schmal; mager;  dürr;   dünn;   trocken;  ermattet;   scheu 〈Pferd〉;   abgemergelt	  trocken	trocken-2
1101	1398	DRY	száraz	  mager;  zehrend 〈Krankheit〉;  dürr;   nackt; trocken;   Boden;  Festland;  Verhalten〉;  Schriftwerk;   gemütlos;  Stil〉;  ausgetrocknet;   festländisch;  hager 〈Person〉;  mager machend;   nicht durch Wasser betrieben 〈Mühle〉;  prosaisch;   trocken 〈Speise〉;  kalt 〈Kost〉;   trocken 〈Amme〉;  nicht melkbar 〈altes Muttertier〉;   nicht vollgültig 〈Gegenstand〉;  seinen Aufgaben nicht voll nachkommend 〈Person〉;  trocken 〈Person;  fad 〈Vortrag;   trocken 〈Wein〉;   trockener Teil;   Trockenes 〈Kleidung〉;   Trockenfutter	trocken	trocken-3
1102	1786	DRY UP	töpped	  runzelig werden 〈Haut〉; verdorren 〈Obst〉;   trocknen;  verschmachten;   klebenbleiben	  trocknen	trocknen-1
1103	1360	DUCK	kacsa	Ente;   haltloses Gerücht;   Note »ungenügend« 〈in der Schülerspr〉;   Harngefäß für Kranke;   flaches Steinchen auf eine gewisse Art auf die Wasseroberfläche werfen	Ente	Ente-1
1104	1360	DUCK	réce	Ente	Ente	Ente-2
1105	1360	DUCK	ruca ×	Ente	Ente	Ente-3
1106	1360	DUCK	tóka² ×	ente	ente	ente-1
1107	2	DUST	por	Staub;   Schießpulver;   Pulver 〈Arznei;  Reinigungsmittel usw〉;   Staubhülle 〈des Toten〉;   Überlebtheit;  Verstaubtheit;   Streusand;   Staubgefäß 〈Bot〉;   Klopfer 〈Stange;  Städler〉	Staub	Staub-3
1108	363	DWELL (LIVE, RESIDE)	él¹	 Nahrung;  gebrauchen;  gebrauchen;   Amme;   Amme; leben; leben;   sich nähren;   sich nähren;  sich erhalten;  sich erhalten;   benützen;   benützen;   mit jemandem 〈dauernd〉zusammen sein;  mit jemandem zusammen wohnen;   irgendein Leben führen;  irgendwelchem Zustand sein;   in dauerndem Geschlechtsverhältnis leben;  in ehelichem Verhältnis leben;   sich aufhalten;  wohnen;  wohnen;   Lebensmittel;   Lebensmittel;   Lebensmittel;  Lebensmittel;   Lebensmittel;  élet;  használat;  használat;   Lebendige;   Lebendige;   életmód;   Leben;   Leben;   Leben;   Leben;  megélhetés;   Unterhalt;   Unterhalt;  Fortkommen;  Fortkommen;   Getreide;   Getreide;  ház és udvar;  belsőség;   nähren;   nähren;  beleben;  beleben;  valaminek a használatára késztet;   hochleben lassen;   hochleben lassen;   Lebens-;   Lebens-;   bejahrt werden;   bejahrt werden;   bejahrt werden;   bejahrt werden;   lebhaft werden;   lebhaft werden;  erstarken;  erstarken;   genießbar;   genießbar;  brauchbar;  brauchbar;  életrevaló;  életképes;  táplál;   Hefe;   Hefe;   sich fristen;   sich fristen;  valamiből él;   schmarotzen;   schmarotzen;  Zehrung;  Zehrung;  élvezet;   Erlebnis;   Erlebnis;   lebenslang ;   lebenslang;   mit jmdm zusammenleben;  bei jmdm leben;    Leben führen;  sich  befinden;   mit jmdm  leben;   verweilen;  Broterwerb	 wohnen	wohnen-1
