ID,Local_ID,Language_ID,Parameter_ID,Value,Form,Segments,Comment,Source,Cognacy,Loan,Graphemes,Profile,Meaning,Sense_ID,Entry_ID
Hungarian-482-klein-3,777,Hungarian,482-klein,apród,apród,ɒ p r oː d,,uesz,,,^ a p r ó d $,default,klein; Kind; Lehrling; Schildknappe; Page; Kurmacher; kleinweise,klein-3,309-aprod
Hungarian-324-spaten-1,796,Hungarian,324-spaten,ás,ás,aː ʃ,,uesz,,,^ á s $,default,Grube; graben; Gräber; Spaten; Ausgegrabenes,Spaten-1,368-as
Hungarian-232-rede-1,799,Hungarian,232-rede,akció,akció,ɒ k t͡s i oː,,uesz,,,^ a k c i ó $,default,Klage; Klageschrift; Angelegenheit; Rede; Rolle; Behandlung; Handlung; Tätigkeit; Wirkung; Geltrafe; Aktion als grammatischer Terminus,Rede-1,136-akcio
Hungarian-677-stehen-1,809,Hungarian,677-stehen,áll¹,áll,aː lː,,uesz,,,^ á ll $,default,behaupten; behaupten; stehen; sich in einer Lage befinden; stillstehen; emporragen; sich erheben; bestehen; existieren; gelten 〈Wort usw.〉; aushalten; ertragen; in eine Lage; in einen Zustand kommen; abhängen; sich zusammensetzen; sich offenbaren; fortdauern; erhalten bleiben; wert sein; kosten; stellen; stellen; Stelle; Position; Dienststelle,stehen-1,202-all
Hungarian-754-sicherheben-1,810,Hungarian,754-sicherheben,áll¹,áll,aː lː,,uesz,,,^ á ll $,default,behaupten; behaupten; stehen; sich in einer Lage befinden; stillstehen; emporragen; sich erheben; bestehen; existieren; gelten 〈Wort usw.〉; aushalten; ertragen; in eine Lage; in einen Zustand kommen; abhängen; sich zusammensetzen; sich offenbaren; fortdauern; erhalten bleiben; wert sein; kosten; stellen; stellen; Stelle; Position; Dienststelle,sicherheben-1,202-all
Hungarian-431-staat-1,812,Hungarian,431-staat,állam,állam,aː lː ɒ m,,uesz,,,^ á ll a m $,default,Substanz; Haltbarkeit; Staat; substantiell; staatlich,Staat-1,205-allam
Hungarian-964-umruhren-1,819,Hungarian,964-umruhren,agitál,agitál,ɒ ɡ i t aː l,,uesz,,,^ a g i t á l $,default,unterhandeln; unterhandeln; Tätigkeit entfalten; Tätigkeit entfalten; umrühren; umrühren; gewinnen; gewinnen; aufmuntern; aufmuntern; aufwiegeln; aufwiegeln,umruhren-1,103-agital
Hungarian-964-umruhren-2,820,Hungarian,964-umruhren,agitál,agitál,ɒ ɡ i t aː l,,uesz,,,^ a g i t á l $,default,unterhandeln; unterhandeln; Tätigkeit entfalten; Tätigkeit entfalten; umrühren; umrühren; gewinnen; gewinnen; aufmuntern; aufmuntern; aufwiegeln; aufwiegeln,umruhren-2,103-agital
Hungarian-64-stein-1,822,Hungarian,64-stein,asztag,asztag,ɒ s t ɒ ɡ,,uesz,,,^ a sz t a g $,default,Heuschober; Feimen; Stein-; Holzhaufen; Scheune,Stein-1,390-asztag
Hungarian-691-stromen-1,826,Hungarian,691-stromen,ár¹  ∆,ár,aː r,,uesz,,,^ á r $,default,strömen; schwellen,stromen-1,311-ar
Hungarian-691-stromen-2,827,Hungarian,691-stromen,áramlik,áramlik,aː r ɒ m l i k,,uesz,,,^ á r a m l i k $,default,strömen,stromen-2,316-aramlik
Hungarian-934-schlagen-1,829,Hungarian,934-schlagen,akaszt,akaszt,ɒ k ɒ s t,,uesz,,,^ a k a sz t $,default,hängen; hängen; schlagen; Haken; Haken; binden; binden,schlagen-1,100-akaszt
Hungarian-544-dumm-1,834,Hungarian,544-dumm,antal †,antal,ɒ n t ɒ l,,uesz,,,^ a n t a l $,default,dumm; töricht,dumm-1,275-antal
Hungarian-311-tisch-1,853,Hungarian,311-tisch,asztal,asztal,ɒ s t ɒ l,,uesz,,,^ a sz t a l $,default,Tisch; Verpflegung; Kost; viereckige Wune; Brettergerüst an der Dreschmaschine; an der Seite des Kornschobers usw.; Tischler,Tisch-1,391-asztal
Hungarian-805-probieren-1,858,Hungarian,805-probieren,áll¹,áll,aː lː,,uesz,,,^ á ll $,default,behaupten; behaupten; stehen; sich in einer Lage befinden; stillstehen; emporragen; sich erheben; bestehen; existieren; gelten 〈Wort usw.〉; aushalten; ertragen; in eine Lage; in einen Zustand kommen; abhängen; sich zusammensetzen; sich offenbaren; fortdauern; erhalten bleiben; wert sein; kosten; stellen; stellen; Stelle; Position; Dienststelle,kosten-1,202-all
Hungarian-910-lehren-1,861,Hungarian,910-lehren,abriktol ×,abriktol,ɒ b r i k t o l,,uesz,,,^ a b r i k t o l $,default,prügeln; unterrichten,unterrichten-1,18-abriktol
Hungarian-638-das-1,868,Hungarian,638-das,az¹,az,ɒ z,,uesz,,,^ a z $,default,jener; jener; auf diejenige Weise,jener-1,434-az
Hungarian-638-das-2,869,Hungarian,638-das,az¹,az,ɒ z,,uesz,,,^ a z $,default,jener; jener; auf diejenige Weise,jener-2,434-az
Hungarian-638-das-3,870,Hungarian,638-das,az²,az,ɒ z,,uesz,,,^ a z $,default,der; die; das,das-1,435-az
Hungarian-271-sache-1,878,Hungarian,271-sache,állat,állat,aː lː ɒ t,,uesz,,,^ á ll a t $,default,Gestalt; Gerät; Wesen; Zustand; Lebewesen; Sache; Tier; Vierfüßer; nagy termetű,Sache-1,210-allat
Hungarian-993-denken-1,879,Hungarian,993-denken,alít ×,alít,ɒ l iː t,,uesz,,,^ a l í t $,default,meinen; denken; sich getrauen zu glauben; hoffen; bekräftigen; behaupten; einer Sache Beachtung schenken; in Betracht ziehen,denken-1,192-alit
Hungarian-633-durch-1,890,Hungarian,633-durch,által,által,aː l t ɒ l,,uesz,,,^ á l t a l $,default,absolut; über; durch; durch; gerade; kurz; von; vermittelst; allgemein; das absolute Ding,durch-1,235-altal
Hungarian-633-durch-2,891,Hungarian,633-durch,által,által,aː l t ɒ l,,uesz,,,^ á l t a l $,default,absolut; über; durch; durch; gerade; kurz; von; vermittelst; allgemein; das absolute Ding,durch-2,235-altal
Hungarian-857-binden-1,896,Hungarian,857-binden,akaszt,akaszt,ɒ k ɒ s t,,uesz,,,^ a k a sz t $,default,hängen; hängen; schlagen; Haken; Haken; binden; binden,binden-1,134-akaszt
Hungarian-857-binden-2,897,Hungarian,857-binden,akaszt,akaszt,ɒ k ɒ s t,,uesz,,,^ a k a sz t $,default,hängen; hängen; schlagen; Haken; Haken; binden; binden,binden-2,134-akaszt
Hungarian-240-ton-1,906,Hungarian,240-ton,agyag,agyag,ɒ ɟ ɒ ɡ,,uesz,,,^ a gy a g $,default,Ton; Ton; Lehm,Ton-1,111-agyag
Hungarian-240-ton-2,907,Hungarian,240-ton,agyag,agyag,ɒ ɟ ɒ ɡ,,uesz,,,^ a gy a g $,default,Ton; Ton; Lehm,Ton-2,111-agyag
Hungarian-180-falle-1,914,Hungarian,180-falle,árkány ×,árkány,aː r k aː ɲ,,uesz,,,^ á r k á ny $,default,Fangschlinge; Falle,Falle-1,341-arkany
Hungarian-293-gang-1,947,Hungarian,293-gang,allűr,allűr,ɒ lː yː r,,uesz,,,^ a ll ű r $,default,Gang; Haltung; Manier,Gang-1,218-allur
Hungarian-814-wollen-1,949,Hungarian,814-wollen,akar,akar,ɒ k ɒ r,,uesz,,,^ a k a r $,default,wollen; wollen; freiwillig; freiwillig; gewaltsam; gewaltsam; erőszakos,wollen-1,132-akar
Hungarian-814-wollen-2,950,Hungarian,814-wollen,akar,akar,ɒ k ɒ r,,uesz,,,^ a k a r $,default,wollen; wollen; freiwillig; freiwillig; gewaltsam; gewaltsam; erőszakos,wollen-2,132-akar
Hungarian-426-ware-1,952,Hungarian,426-ware,áru,áru,aː r u,,uesz,,,^ á r u $,default,verkaufen; Ware; Verhandeln; Verrat; elárusít; Verkäufer; Verkäufer; Verkäufer; Verräter; Verräter; Verräter,Ware-1,361-aru
Hungarian-61-wind-1,980,Hungarian,61-wind,ájer ×,ájer,aː j ɛ r,,uesz,,,^ á j e r $,default,Luft; Luft; Atmosphäre; Atmosphäre; heilkräftige Flüssigkeit; heilkräftige Flüssigkeit; Wind; Wind; Gestank; Gestank,Wind-1,123-ajer
Hungarian-61-wind-2,981,Hungarian,61-wind,ájer ×,ájer,aː j ɛ r,,uesz,,,^ á j e r $,default,Luft; Luft; Atmosphäre; Atmosphäre; heilkräftige Flüssigkeit; heilkräftige Flüssigkeit; Wind; Wind; Gestank; Gestank,Wind-2,123-ajer
Hungarian-317-fenster-1,982,Hungarian,317-fenster,ablak,ablak,ɒ b l ɒ k,,uesz,,,^ a b l a k $,default,Fenster; Rauchloch,Fenster-1,12-ablak
Hungarian-317-fenster-2,983,Hungarian,317-fenster,akna,akna,ɒ k n ɒ,,uesz,,,^ a k n a $,default,Fenster; Öffnung; Salzgrube; Spundloch; Spund; Schacht; Bergwerk; Kamin; Pulvergang; Sprenggrube; Faßdaube mit Spundloch; Visierstab; Seemine; Tretmine; Geschoß des Minenwerfers; Grubensteiger; Mineur 〈Soldat〉,Fenster-2,142-akna
Hungarian-194-frau-1,988,Hungarian,194-frau,asszony,asszony,ɒ sː o ɲ,,uesz,,,^ a ssz o ny $,default,Königin; Herrin; Frau; verheiratete Frau; Fräulein; weibliches Geschlecht; Fraulichkeit,Frau-1,389-asszony
Hungarian-164-wurm-1,996,Hungarian,164-wurm,alkörmös ∆,alkörmös,ɒ l k ø r m ø ʃ,,uesz,,,^ a l k ö r m ö s $,default,Art Artznei; Kermesbeere; Kermesbeere; Farbstoff aus dieser Pflanze; Art süßer Branntwein; roter Farbstoff; Getränk; Artznei usw; Art roter Artznei; Purpurlaus; Wurm; süßer; roter Branntwein,Wurm-1,200-alkormos
